,article_id,Code,Date,Date_lag,Company,headline,orgs_mentioned,key_phrase,save_time,online_found
5322,744719,CNE.L,2001-03-07,2001-03-06, Cairn Energy;,SHORTS: Cairn pledges to remain independent, Cairn Energy;,Cairn Energy,2023-03-30 17:11:18.951703,Yes
5323,845034,CNE.L,2002-08-05,2002-08-04, Cairn;,"ONGC mulls offer for Cairn's assets OIL & GAS TALKS UNDER WAY WITH INDIAN STATE
COMPANY:", Natural Gas Corporation; Morgan Stanley;,Natural Gas Corporation Morgan Stanley,2023-03-30 17:11:25.287847,No
5324,849790,CNE.L,2002-09-03,2002-09-02, Cairn;,"Cairn Energy plans limited asset sale OIL & GAS COMPANY KEEPS PORTFOLIO UNDER
REVIEW IN ATTEMPT TO MAINTAIN BIAS TOWARDS EXPLORATION:", Natural Gas Corporation; Deutsche Bank; Shell India;,Natural Gas Corporation Deutsche Bank Shell India,2023-03-30 17:11:36.905655,Yes
5325,849790,CNE.L,2002-09-03,2002-09-02, Cairn;,"Cairn Energy plans limited asset sale OIL & GAS COMPANY KEEPS PORTFOLIO UNDER
REVIEW IN ATTEMPT TO MAINTAIN BIAS TOWARDS EXPLORATION:", Natural Gas Corporation; Deutsche Bank; Shell India;,Natural Gas Corporation Deutsche Bank Shell India,2023-03-30 17:11:48.914022,Yes
5326,869541,CNE.L,2002-12-10,2002-12-09, Cairn Energy;,Cairn overhauls structure NEWS DIGEST, New Cairn Energy;,New Cairn Energy,2023-03-30 17:11:55.254865,No
5327,913573,CNE.L,2003-08-05,2003-08-04, Cairn;,Cairn buys Shell's Bangladeshi upstream assets, Energy; Royal Dutch/Shell; Shell; Sangu Development Area; SDA; ABN Amro;,Energy Royal Dutch Shell Shell Sangu Development Area SDA ABN Amro,2023-03-30 17:12:01.368751,No
5328,926504,CNE.L,2003-10-13,2003-10-12, Cairn Energy;,And finally... Cairn Energy, Artemis Investment Management; Filofax Group; Cairn Energy;,Artemis Investment Management Filofax Group Cairn Energy,2023-03-30 17:12:07.679471,No
5329,926504,CNE.L,2003-10-13,2003-10-12, Cairn Energy;,And finally... Cairn Energy, Artemis Investment Management; Filofax Group; Cairn Energy;,Artemis Investment Management Filofax Group Cairn Energy,2023-03-30 17:12:13.796076,No
5330,955412,CNE.L,2004-03-10,2004-03-09, Cairn Energy;,Cairn's oil find lifts peers but blue-chip index falls LONDON:, Cairn Energy; Shell; Paladin Resources; BAE Systems; Deutsche Bank; Siemens; WPP; Volkswagen; GKN; UBS Capital;,Cairn Energy Shell Paladin Resources BAE Systems Deutsche Bank Siemens WPP Volkswagen GKN UBS Capital,2023-03-30 17:12:19.946233,No
5331,955328,CNE.L,2004-03-10,2004-03-09, Cairn;,Cairn Energy LOMBARD, Shell;,Shell,2023-03-30 17:12:33.296580,Yes
5332,955328,CNE.L,2004-03-10,2004-03-09, Cairn;,Cairn Energy LOMBARD, Shell;,Shell,2023-03-30 17:12:46.086129,Yes
5333,963167,CNE.L,2004-04-21,2004-04-20, Cairn;,Cairn eclipses competitors to make third Indian field discovery OIL & GAS:, Energy; Shell.; Merrill Lynch;,Energy Shell Merrill Lynch,2023-03-30 17:12:52.175034,No
5334,1045933,CNE.L,2005-09-21,2005-09-20, Cairn;,Reserves boost makes Cairn look attractive, UK; Cairn;,UK Cairn,2023-03-30 17:12:58.198452,No
5335,1069513,CNE.L,2006-02-24,2006-02-23, Cairn;,Cairn Energy defies oil sector dip by virtue of renewed  takeover talk LONDON, Energy; Royal Dutch Shell; Oil & Natural Gas Corp of; Cable & Wireless; Body Shop; Oriel Securities; Reuters; Numis Securities; BAE Systems; US; Morgan Stanley; Capita Group; Capital; Colt Telecom;,Energy Royal Dutch Shell Oil Natural Gas Corp of Cable Wireless Body Shop Oriel Securities Reuters Numis Securities BAE Systems US Morgan Stanley Capita Group Capital Colt Telecom,2023-03-30 17:13:04.922462,No
5336,1069513,CNE.L,2006-02-24,2006-02-23, Cairn;,Cairn Energy defies oil sector dip by virtue of renewed  takeover talk LONDON, Energy; Royal Dutch Shell; Oil & Natural Gas Corp of; Cable & Wireless; Body Shop; Oriel Securities; Reuters; Numis Securities; BAE Systems; US; Morgan Stanley; Capita Group; Capital; Colt Telecom;,Energy Royal Dutch Shell Oil Natural Gas Corp of Cable Wireless Body Shop Oriel Securities Reuters Numis Securities BAE Systems US Morgan Stanley Capita Group Capital Colt Telecom,2023-03-30 17:13:11.442355,No
5337,1090459,CNE.L,2006-07-12,2006-07-11, Cairn;,"Cairn's big gamble pays off ENERGY: After 10 years in India, the UK oil company
is investing heavily in its new fields and preparing to list in Mumbai, writes
Khozem Merchant", Shell; International Finance Corporation; World Bank; IFC; Royal Bank; Hindustan Petroleum; Natural Gas Corporation; ONGC; Merrill Lynch;,Shell International Finance Corporation World Bank IFC Royal Bank Hindustan Petroleum Natural Gas Corporation ONGC Merrill Lynch,2023-03-30 17:13:24.053307,Yes
5338,1103334,CNE.L,2006-10-16,2006-10-15, Cairn;,Dollars 500m of Cairn India shares in pre-IPO sale OIL & GAS, National Stock Exchange; International Finance Corporation; World Bank; IPO; Merrill Lynch; ABN Amro Rothschild; JM; Morgan Stanley;,National Stock Exchange International Finance Corporation World Bank IPO Merrill Lynch ABN Amro Rothschild JM Morgan Stanley,2023-03-30 17:13:30.609402,No
5339,1106011,CNE.L,2006-11-02,2006-11-01, Cairn Energy;,Building Cairn India LOMBARD - ANDREW HILL, Energy; UK; Cairn Energy;,Energy UK Cairn Energy,2023-03-30 17:13:42.688063,Yes
5340,1109505,CNE.L,2006-11-24,2006-11-23, Cairn Energy;,Cairn/Petronas LEX COLUMN, Cairn Energy; 30.5; BP; Energy;,Cairn Energy BP Energy,2023-03-30 17:13:54.670115,Yes
5341,1110172,CNE.L,2006-11-28,2006-11-27, Cairn Energy;,Cairn on course to return Pounds 700m on India float OIL & GAS, Energy; Malaysian; Cairn Energy;,Energy Malaysian Cairn Energy,2023-03-30 17:14:07.058802,Yes
5342,1113182,CNE.L,2006-12-19,2006-12-18, Cairn;,Cairn sale at bottom of range OIL & GAS, Energy; Malaysian;,Energy Malaysian,2023-03-30 17:14:13.391415,No
5343,1114996,CNE.L,2007-01-08,2007-01-07, Cairn;,"End of one chapter and the start of yet another Ed Crooks talks to Sir Bill
Gammell about life after the Cairn India flotation and his belief in the
transforming power of positive thinking", Financial Times; Energy; IPO; Scottish Institute of Sport Foundation; Australian Sports Commission;,Financial Times Energy IPO Scottish Institute of Sport Foundation Australian Sports Commission,2023-03-30 17:14:20.032715,No
5344,1115125,CNE.L,2007-01-10,2007-01-09, Cairn Energy;,Cairn India debut suffers double whammy, UK-based Cairn Energy; Cairn Energy; Edelweiss Capital;,UK based Cairn Energy Cairn Energy Edelweiss Capital,2023-03-30 17:14:26.673367,No
5345,1123137,CNE.L,2007-02-28,2007-02-27, Cairn Energy;,Cairn Energy returns Pounds 481m to investors, Capricorn Energy; Cairn Energy; UK; Energy;,Capricorn Energy Cairn Energy UK Energy,2023-03-30 17:14:38.553972,Yes
5346,1123137,CNE.L,2007-02-28,2007-02-27, Cairn Energy;,Cairn Energy returns Pounds 481m to investors, Capricorn Energy; Cairn Energy; UK; Energy;,Capricorn Energy Cairn Energy UK Energy,2023-03-30 17:14:50.477229,Yes
5347,1127506,CNE.L,2007-03-28,2007-03-27, Cairn;,Cairn confident in Indian pipeline deal, Energy; Indian Oil Corporation.;,Energy Indian Oil Corporation,2023-03-30 17:14:56.890524,No
5348,1138916,CNE.L,2007-06-15,2007-06-14, Cairn Energy;,Red tape threat to Cairn oil projects, UK-listed Cairn Energy; BG Group; Natural Gas Corp (; ONGC;,UK listed Cairn Energy BG Group Natural Gas Corp ONGC,2023-03-30 17:15:08.708054,Yes
5349,1139952,CNE.L,2007-06-21,2007-06-20, Cairn Energy;,India urged to move on Cairn oil, World Bank; UK-listed Cairn Energy; International Finance Corporation; Reuters; Hindustan Petroleum Corp.;,World Bank UK listed Cairn Energy International Finance Corporation Reuters Hindustan Petroleum Corp,2023-03-30 17:15:15.245080,No
5350,1150745,CNE.L,2007-09-12,2007-09-11, Cairn Energy;,Indian approval aids Cairn Energy, Cairn Energy; UK-listed Cairn Energy; Plectrum Petroleum;,Cairn Energy UK listed Cairn Energy Plectrum Petroleum,2023-03-30 17:15:27.045788,Yes
5351,1150745,CNE.L,2007-09-12,2007-09-11, Cairn Energy;,Indian approval aids Cairn Energy, Cairn Energy; UK-listed Cairn Energy; Plectrum Petroleum;,Cairn Energy UK listed Cairn Energy Plectrum Petroleum,2023-03-30 17:15:39.551268,Yes
5352,1162885,CNE.L,2007-11-13,2007-11-12, Cairn Energy;,Pipeline blow for Cairn India, Energy; International Energy Agency; Ministry of Petroleum and Natural Gas; World View;,Energy International Energy Agency Ministry of Petroleum and Natural Gas World View,2023-03-30 17:15:46.134890,No
5353,1176978,CNE.L,2008-01-28,2008-01-27, Cairn Energy;,Cairn hopeful on India deal, London-listed Cairn Energy; Cairn Energy; Credit Suisse; New Exploration Licensing Policy; Royal Dutch Shell.;,London listed Cairn Energy Cairn Energy Credit Suisse New Exploration Licensing Policy Royal Dutch Shell,2023-03-30 17:15:52.814451,No
5354,1176984,CNE.L,2008-01-28,2008-01-27, Cairn Energy;,Cairn India approval close, London-listed Cairn Energy; Financial Times; Cairn Energy; Credit Suisse;,London listed Cairn Energy Financial Times Cairn Energy Credit Suisse,2023-03-30 17:16:05.342336,Yes
5355,1187005,CNE.L,2008-03-18,2008-03-17, Cairn;,Cairn India raises Dollars 625m to cover rise in oilfield costs, Energy;,Energy,2023-03-30 17:16:21.359276,Yes
5356,1194931,CNE.L,2008-05-01,2008-04-30, Cairn Energy;,Green light for $800m Cairn India pipeline, Ministry of Petroleum and Natural Gas; New Exploration Licensing Policy VII; London-listed Cairn Energy;,Ministry of Petroleum and Natural Gas New Exploration Licensing Policy VII London listed Cairn Energy,2023-03-30 17:16:33.600740,Yes
5357,1276980,CNE.L,2009-10-15,2009-10-14, Cairn;,Cairn raises$310m for Greenland exploration, Energy; Malaysian;,Energy Malaysian,2023-03-30 17:16:45.818034,Yes
5358,1288127,CNE.L,2010-01-05,2010-01-04, Cairn Energy;,Cairn secures second Greenland rig, Cairn Energy; RBS Hoare Govett;,Cairn Energy RBS Hoare Govett,2023-03-30 17:16:57.871436,Yes
5359,1298932,CNE.L,2010-03-23,2010-03-22, Cairn Energy;,"Business diary: Jann Brown, Cairn Energy", Cairn Energy; Energy; UK Budget; FD;,Cairn Energy Energy UK Budget FD,2023-03-30 17:17:09.849822,Yes
5360,1298932,CNE.L,2010-03-23,2010-03-22, Cairn Energy;,"Business diary: Jann Brown, Cairn Energy", Cairn Energy; Energy; UK Budget; FD;,Cairn Energy Energy UK Budget FD,2023-03-30 17:17:21.945453,Yes
5361,1317367,CNE.L,2010-08-12,2010-08-11, Cairn Energy;,Cairn leads fallers after cooling over Greenland interests, Cairn Energy; Credit Suisse; UK; US; Lloyds Banking Group; Vedanta Resources; Nomura; Inmarsat; Capital Group; Man Group; GLG Partners; Bank of New York Mellon; Goldman Sachs;,Cairn Energy Credit Suisse UK US Lloyds Banking Group Vedanta Resources Nomura Inmarsat Capital Group Man Group GLG Partners Bank of New York Mellon Goldman Sachs,2023-03-30 17:17:28.758646,No
5362,1317464,CNE.L,2010-08-13,2010-08-12, Cairn;,Vedanta in talks to buy stake in Cairn India, Energy; Liberum Capital;,Energy Liberum Capital,2023-03-30 17:17:35.137662,No
5363,1317863,CNE.L,2010-08-16,2010-08-15, Cairn Energy;,Vedanta finalises plans over Cairn India, Cairn Energy; Natural Gas Company;,Cairn Energy Natural Gas Company,2023-03-30 17:17:47.537997,Yes
5364,1318081,CNE.L,2010-08-18,2010-08-17, Cairn Energy;,Vedanta/Cairn, Vedanta Resources; Natural Gas Corp; Cairn Energy;,Vedanta Resources Natural Gas Corp Cairn Energy,2023-03-30 17:17:59.515593,Yes
5365,1318675,CNE.L,2010-08-25,2010-08-24, Cairn Energy;,Cairn Energy, Dana Petroleum; Korea National Oil Corp seems; Energy; Cairn Energy;,Dana Petroleum Korea National Oil Corp seems Energy Cairn Energy,2023-03-30 17:18:11.611285,Yes
5366,1318675,CNE.L,2010-08-25,2010-08-24, Cairn Energy;,Cairn Energy, Dana Petroleum; Korea National Oil Corp seems; Energy; Cairn Energy;,Dana Petroleum Korea National Oil Corp seems Energy Cairn Energy,2023-03-30 17:18:23.959535,Yes
5367,1318957,CNE.L,2010-08-26,2010-08-25, Cairn;,Cairn rallies but oil and mining drag down Footsie, Vedanta Resources; US; BHP; Kazakhmys; Goldman Sachs; BP; Admiral Group; Morgan Stanley; Drax Group; SIG; Promethean World;,Vedanta Resources US BHP Kazakhmys Goldman Sachs BP Admiral Group Morgan Stanley Drax Group SIG Promethean World,2023-03-30 17:18:30.627241,No
5368,1323242,CNE.L,2010-09-30,2010-09-29, Cairn;,Smelter closure puts spotlight on Vedanta's Cairn India move, London-listed; Vedanta Resources; Congress party; Madras High Court;,London listed Vedanta Resources Congress party Madras High Court,2023-03-30 17:18:42.932603,Yes
5369,1324748,CNE.L,2010-10-12,2010-10-11, Cairn;,Cairn warns Delhi over $9bn sale of Indian energy stake to Vedanta, Energy; UK; Financial Times; Shell; Rs405;,Energy UK Financial Times Shell Rs,2023-03-30 17:18:49.159536,No
5370,1326822,CNE.L,2010-10-27,2010-10-26, Cairn;,Cairn Energy suffers blow to Arctic drilling programme, Arctic Circle.; Oriel Securities; Chevron -; BP;,Arctic Circle Oriel Securities Chevron BP,2023-03-30 17:19:00.849564,Yes
5371,1326822,CNE.L,2010-10-27,2010-10-26, Cairn;,Cairn Energy suffers blow to Arctic drilling programme, Arctic Circle.; Oriel Securities; Chevron -; BP;,Arctic Circle Oriel Securities Chevron BP,2023-03-30 17:19:12.959854,Yes
5372,1335712,CNE.L,2011-01-05,2011-01-04, Cairn;,Cairn hires rigs for Arctic oil search, Arctic Circle.; Panmure Gordon; Chevron; BP;,Arctic Circle Panmure Gordon Chevron BP,2023-03-30 17:19:25.120868,Yes
5373,1340278,CNE.L,2011-02-09,2011-02-08, Cairn Energy;,Singh intervenes in Cairn India impasse, Energy; Natural Gas Corporation; Cairn Energy; ONGC; See Inside Business;,Energy Natural Gas Corporation Cairn Energy ONGC See Inside Business,2023-03-30 17:19:31.460038,No
5374,1340295,CNE.L,2011-02-09,2011-02-08, Cairn Energy;,India risks investment backlash in $9bn Cairn crisis, Edinburgh-based Cairn Energy; UK; Natural Gas Corporation; FT; Asia Regional Correspondent;,Edinburgh based Cairn Energy UK Natural Gas Corporation FT Asia Regional Correspondent,2023-03-30 17:19:37.926781,No
5375,1347726,CNE.L,2011-04-06,2011-04-05, Cairn Energy;,Vedanta climbs on Cairn India hopes, Cairn Energy; Siemens;,Cairn Energy Siemens,2023-03-30 17:19:50.010269,Yes
5376,1347843,CNE.L,2011-04-06,2011-04-05, Cairn Energy;,Boost for Vedanta as Cairn India saga seen close to a resolution, Cairn Energy; Siemens; TUI AG; TUI Travel; Home Retail Group; Capital Partners; US; 4.25; FCStone Inc; Kalahari Minerals; CGNPC Uranium Resources; Porvair;,Cairn Energy Siemens TUI AG TUI Travel Home Retail Group Capital Partners US FCStone Inc Kalahari Minerals CGNPC Uranium Resources Porvair,2023-03-30 17:20:01.677511,Yes
5377,1348022,CNE.L,2011-04-07,2011-04-06, Cairn Energy;,New Delhi indecision hits Vedanta's Cairn hopes, London-listed; Vedanta Resources; Cairn Energy; Natural Gas Corporation; Energy;,London listed Vedanta Resources Cairn Energy Natural Gas Corporation Energy,2023-03-30 17:20:13.765973,Yes
5378,1348047,CNE.L,2011-04-07,2011-04-06, Cairn Energy;,Vedanta's Cairn India deal faces more delay, London-listed; Vedanta Resources; Cairn Energy; Natural Gas Corporation; Energy;,London listed Vedanta Resources Cairn Energy Natural Gas Corporation Energy,2023-03-30 17:20:25.947224,Yes
5379,1348217,CNE.L,2011-04-08,2011-04-07, Cairn Energy;,Vedanta to pursue 20% stake in Cairn India as takeover stalled, Cairn Energy; Natural Gas Corporation of India; Energy; Securities and Exchange Board of India; Rs355;,Cairn Energy Natural Gas Corporation of India Energy Securities and Exchange Board of India Rs,2023-03-30 17:20:32.202905,No
5380,1348263,CNE.L,2011-04-08,2011-04-07, Cairn Energy;,Stalling bureaucrats edge Cairn towards compromise, Cairn Energy; Vedanta Resources; US; Energy;,Cairn Energy Vedanta Resources US Energy,2023-03-30 17:20:43.859514,Yes
5381,1349709,CNE.L,2011-04-20,2011-04-19, Cairn Energy;,Vedanta buys stake in Cairn India, Malaysian; Energy; Merrill Lynch; Natural Gas Corp over;,Malaysian Energy Merrill Lynch Natural Gas Corp over,2023-03-30 17:20:55.545297,Yes
5382,1351281,CNE.L,2011-05-04,2011-05-03, Cairn;,Vedanta/Cairn India, Natural Gas Corp; Deutsche Bank;,Natural Gas Corp Deutsche Bank,2023-03-30 17:21:07.527828,Yes
5383,1355612,CNE.L,2011-06-07,2011-06-06, Cairn;,Court delays Cairn injunction over Greenpeace Arctic protest, navy;,navy,2023-03-30 17:21:19.503674,Yes
5384,1356960,CNE.L,2011-06-17,2011-06-16, Cairn Energy;,Cairn's Gammell passes the ball but not the buck, Cairn Energy;,Cairn Energy,2023-03-30 17:21:31.279614,Yes
5385,1358256,CNE.L,2011-06-28,2011-06-27, Cairn;,Cairn revises Vedanta deal terms in bid to win approval, Vedanta Resources; Oil & Natural Gas Corporation.;,Vedanta Resources Oil Natural Gas Corporation,2023-03-30 17:21:43.161551,Yes
5386,1359310,CNE.L,2011-07-04,2011-07-03, Cairn Energy;,Intensive Cairn, UK; Cairn Energy; Energy;,UK Cairn Energy Energy,2023-03-30 17:21:55.161657,Yes
5387,1364801,CNE.L,2011-08-24,2011-08-23, Cairn;,Cairn at helm of Lebanon drill bid group, Energy; Cairn; Vedanta Resources;,Energy Cairn Vedanta Resources,2023-03-30 17:22:06.817510,Yes
5388,1367082,CNE.L,2011-09-14,2011-09-13, Cairn;,Cairn Energy, Energy; Bloomberg; US Geological Survey;,Energy Bloomberg US Geological Survey,2023-03-30 17:22:12.904950,No
5389,1367082,CNE.L,2011-09-14,2011-09-13, Cairn;,Cairn Energy, Energy; Bloomberg; US Geological Survey;,Energy Bloomberg US Geological Survey,2023-03-30 17:22:19.122956,No
5390,1367517,CNE.L,2011-09-15,2011-09-14, Cairn Energy;,Cairn progresses in sale of $6.5bn stake, Energy; Vedanta Resources; Natural Gas Corporation.; Cairn Energy; BP; Reliance Industries; Ministry of Home Affairs;,Energy Vedanta Resources Natural Gas Corporation Cairn Energy BP Reliance Industries Ministry of Home Affairs,2023-03-30 17:22:31.604395,Yes
5391,1377382,CNE.L,2011-12-01,2011-11-30, Cairn Energy;,Cairn fails in search off Greenland, Cairn Energy;,Cairn Energy,2023-03-30 17:22:43.718274,Yes
5392,1377434,CNE.L,2011-12-01,2011-11-30, Cairn Energy;,Cairn calls off $600m drilling project, Cairn Energy; 202km;,Cairn Energy km,2023-03-30 17:22:49.795610,No
5393,1377946,CNE.L,2011-12-06,2011-12-05, Cairn Energy;,Vedanta's Cairn India deal hailed, Cairn Energy; Edinburgh-based Cairn Energy; Financial Times; BP; Reliance Industries; Energy; Natural Gas Corporation; Washington-based International Finance Corporation;,Cairn Energy Edinburgh based Cairn Energy Financial Times BP Reliance Industries Energy Natural Gas Corporation Washington based International Finance Corporation,2023-03-30 17:23:01.756028,Yes
5394,1378755,CNE.L,2011-12-12,2011-12-11, Cairn Energy;,Cairn and able," Cairn Energy; Energy; 1,000; Rajasthan;",Cairn Energy Energy Rajasthan,2023-03-30 17:23:13.837683,Yes
5395,1382510,CNE.L,2012-01-19,2012-01-18, Cairn;,Cairn Energy shareholders take aim at chief's £2.5m pay award, Association of British Insurers; UK;,Association of British Insurers UK,2023-03-30 17:23:25.869003,Yes
5396,1382510,CNE.L,2012-01-19,2012-01-18, Cairn;,Cairn Energy shareholders take aim at chief's £2.5m pay award, Association of British Insurers; UK;,Association of British Insurers UK,2023-03-30 17:23:38.175946,Yes
5397,1383343,CNE.L,2012-01-24,2012-01-23, Cairn;,Cairn sells part of Greenland stake, 160p-a-share;,p a share,2023-03-30 17:23:50.963603,Yes
5398,1383220,CNE.L,2012-01-25,2012-01-24, Cairn;,Cairn retreats on £2.5m award, Energy; Legal & General Investment Management; Vedanta Resources;,Energy Legal General Investment Management Vedanta Resources,2023-03-30 17:23:57.181848,No
5399,1383222,CNE.L,2012-01-25,2012-01-24, Cairn;,Greenland has chilled the mood at Cairn, Association of British Insurers; Bernstein Research; Bank of America Merrill Lynch;,Association of British Insurers Bernstein Research Bank of America Merrill Lynch,2023-03-30 17:24:09.297570,Yes
5400,1390354,CNE.L,2012-03-21,2012-03-20, Cairn Energy;,Cairn eyes further targets to explore, Cairn Energy;,Cairn Energy,2023-03-30 17:24:21.027819,Yes
5401,1391668,CNE.L,2012-04-04,2012-04-03, Cairn Energy;,Energy groups fire up after Cairn move, Cairn Energy; Agora Oil & Gas.; Canada-listed Sterling Resources; Nautical Petroleum; US; Morgan Stanley; Royal Bank; Lloyds Banking Group; Aberdeen Asset Management;,Cairn Energy Agora Oil Gas Canada listed Sterling Resources Nautical Petroleum US Morgan Stanley Royal Bank Lloyds Banking Group Aberdeen Asset Management,2023-03-30 17:24:33.664686,Yes
5402,1392245,CNE.L,2012-04-10,2012-04-09, Cairn;,Cairn Energy, Energy; Agora Oil; US Geological Survey;,Energy Agora Oil US Geological Survey,2023-03-30 17:24:45.640083,Yes
5403,1392245,CNE.L,2012-04-10,2012-04-09, Cairn;,Cairn Energy, Energy; Agora Oil; US Geological Survey;,Energy Agora Oil US Geological Survey,2023-03-30 17:24:59.571481,Yes
5404,1397072,CNE.L,2012-05-18,2012-05-17, Cairn;,Cairn investors' new revolt over pay, Energy;,Energy,2023-03-30 17:25:16.874270,Yes
5405,1400165,CNE.L,2012-06-14,2012-06-13, Cairn;,Cairn eyes North Sea expansion with £414m Nautical bid, Energy; UK; Vedanta Resources; Oriel Securities;,Energy UK Vedanta Resources Oriel Securities,2023-03-30 17:25:29.266113,Yes
5406,1408076,CNE.L,2012-08-29,2012-08-28, Cairn;,Cairn increases Morocco interests, Energy; Nautical Petroleum;,Energy Nautical Petroleum,2023-03-30 17:25:41.041299,Yes
5407,1410493,CNE.L,2012-09-21,2012-09-20, Cairn Energy;,Agarwal and Cairn India look to foreign fields, Vedanta Resources; UK-based Cairn Energy; Capital; Cairn Energy;,Vedanta Resources UK based Cairn Energy Capital Cairn Energy,2023-03-30 17:25:53.186302,Yes
5408,1413141,CNE.L,2012-10-10,2012-10-09, Cairn Energy;,Vedanta Resources gains boost from Cairn India, Vedanta Resources; London-listed Cairn Energy;,Vedanta Resources London listed Cairn Energy,2023-03-30 17:26:04.902825,Yes
5409,1413921,CNE.L,2012-10-19,2012-10-18, Cairn;,Cairn Energy to restart drilling, Energy; Royal Dutch Shell.; 0.55;,Energy Royal Dutch Shell,2023-03-30 17:26:16.825114,Yes
5410,1413921,CNE.L,2012-10-19,2012-10-18, Cairn;,Cairn Energy to restart drilling, Energy; Royal Dutch Shell.; 0.55;,Energy Royal Dutch Shell,2023-03-30 17:26:28.559120,Yes
5411,1437247,CNE.L,2013-05-17,2013-05-16, Cairn;,Cairn Energy edges higher after talk of exit from the North Sea, Energy; Deutsche Bank; ENRC; Standard Europe; Lloyds Banking Group; Royal Bank of Scotland; Lloyds; AB Foods; EU; 3i Group;,Energy Deutsche Bank ENRC Standard Europe Lloyds Banking Group Royal Bank of Scotland Lloyds AB Foods EU i Group,2023-03-30 17:26:34.817720,No
5412,1437247,CNE.L,2013-05-17,2013-05-16, Cairn;,Cairn Energy edges higher after talk of exit from the North Sea, Energy; Deutsche Bank; ENRC; Standard Europe; Lloyds Banking Group; Royal Bank of Scotland; Lloyds; AB Foods; EU; 3i Group;,Energy Deutsche Bank ENRC Standard Europe Lloyds Banking Group Royal Bank of Scotland Lloyds AB Foods EU i Group,2023-03-30 17:26:41.169640,No
5413,1526680,CNE.L,2016-01-05,2016-01-04, Cairn Energy;,Cairn Energy: making up, Cairn Energy; Conoco; MSCI World Energy; FTSE All-Share;,Cairn Energy Conoco MSCI World Energy FTSE All Share,2023-03-30 17:26:52.930453,Yes
5414,1526680,CNE.L,2016-01-05,2016-01-04, Cairn Energy;,Cairn Energy: making up, Cairn Energy; Conoco; MSCI World Energy; FTSE All-Share;,Cairn Energy Conoco MSCI World Energy FTSE All Share,2023-03-30 17:27:04.502812,Yes
