,article_id,Code,Date,Date_lag,Company,headline,orgs_mentioned,key_phrase,save_time,online_found
6223,734221,GKN.L,2001-01-16,2001-01-15, GKN;,LEX COLUMN: GKN/Brambles LEX COLUMN, GKN; UK; US -;,GKN UK US,2023-03-30 23:19:24.271614,Yes
6224,734281,GKN.L,2001-01-16,2001-01-15, GKN;,"FRONT PAGE - COMPANIES & MARKETS: GKN in talks on Australian deal MERGER
INVOLVING INDUSTRIAL SERVICES ARM MAY BE STEP TO FLOATING COMBINED BUSINESS:", UK; UBS Warburg; GKN; Commonwealth; Handling Equipment Pool; US;,UK UBS Warburg GKN Commonwealth Handling Equipment Pool US,2023-03-30 23:19:35.530621,Yes
6225,735295,GKN.L,2001-01-22,2001-01-21, GKN;,"COMPANIES & FINANCE UK: GKN may take minority stake in Brambles logistics
ENGINEERING DEAL WOULD SEE INDUSTRIAL SERVICES CEDED TO SYDNEY GROUP:", UK; GKN; Brambles;,UK GKN Brambles,2023-03-30 23:19:46.606845,Yes
6226,737289,GKN.L,2001-01-30,2001-01-29, GKN;,"COMPANIES & FINANCE UK AND IRELAND: GKN chief facing the prickly question of
Brambles move: A new challenge may be signalling the end of Sir CK Chow's
four-year reign at the engineering company, writes Peter Marsh:", UK; US; GKN; BOC; BNP Paribas;,UK US GKN BOC BNP Paribas,2023-03-30 23:19:57.855451,Yes
6227,741698,GKN.L,2001-02-19,2001-02-18, GKN;,COMPANIES & FINANCE UK: GKN sees further helicopter consolidation, EADS; United Technologies; Bell; British Army; US; Royal Navy; Navy; Royal Air Force; RAF; Boeing; GKN;,EADS United Technologies Bell British Army US Royal Navy Navy Royal Air Force RAF Boeing GKN,2023-03-30 23:20:09.322113,Yes
6228,742403,GKN.L,2001-02-23,2001-02-22, GKN;,COMPANIES & FINANCE UK: Brambles and GKN still in talks, GKN; SG Securities; UK;,GKN SG Securities UK,2023-03-30 23:20:20.584923,Yes
6229,745260,GKN.L,2001-03-09,2001-03-08, GKN;,SHORTS: GKN chief dismisses fears, GKN;,GKN,2023-03-30 23:20:34.479170,Yes
6230,745325,GKN.L,2001-03-09,2001-03-08, GKN;,"COMPANIES & FINANCE UK: Sir CK sees sum of the parts greater than the whole:
GKN's chief executive believes a break-up of the conglomerate would create two
world-class operations, says Peter Marsh:", UK; US; GKN; Boeing; CK;,UK US GKN Boeing CK,2023-03-30 23:20:45.686849,Yes
6231,745406,GKN.L,2001-03-09,2001-03-08, GKN;,"FRONT PAGE - COMPANIES & MARKETS: GKN moves to calm fears over split AUTOMOBILES
SHARE PRICE FALLS SHARPLY ON CONCERNS ABOUT ENGINEERING DIVISION'S EXPOSURE TO
SLOWDOWN IN US:", GKN; US;,GKN US,2023-03-30 23:20:59.093391,Yes
6232,753732,GKN.L,2001-04-19,2001-04-18, GKN;,FRONT PAGE - COMPANIES & MARKETS: Beresford to head new GKN company, GKN; Old Mutual Securities; UK; UBS Warburg; Macquarie Bank;,GKN Old Mutual Securities UK UBS Warburg Macquarie Bank,2023-03-30 23:21:05.322702,No
6233,753900,GKN.L,2001-04-20,2001-04-19, GKN;,LEX COLUMN: GKN/Brambles LEX COLUMN, GKN;,GKN,2023-03-30 23:21:16.987714,Yes
6234,753972,GKN.L,2001-04-20,2001-04-19, GKN;,COMPANIES & FINANCE UK: Decoupled GKN starts search for purchases, UK; GKN;,UK GKN,2023-03-30 23:21:28.579052,Yes
6235,759771,GKN.L,2001-05-18,2001-05-17, GKN;,Car making decline dents GKN profits, GKN; US; UK;,GKN US UK,2023-03-30 23:21:39.848426,Yes
6236,759849,GKN.L,2001-05-18,2001-05-17, GKN;,GKN hit by falls in US car production ENGINEERING:, US; BSE; GKN;,US BSE GKN,2023-03-30 23:21:51.008114,Yes
6237,762037,GKN.L,2001-05-30,2001-05-29, GKN;,Sir Peter to GKN role PEOPLE, GKN; Master of St Catherine's College Oxford; Oxford Instruments; Japan Business Network of Trade Partners UK.;,GKN Master of St Catherine s College Oxford Oxford Instruments Japan Business Network of Trade Partners UK,2023-03-30 23:21:57.180796,No
6238,763739,GKN.L,2001-06-07,2001-06-06, GKN;,GKN shares fall after warning from Brambles, UK; GKN; Deutsche Bank;,UK GKN Deutsche Bank,2023-03-30 23:22:08.523672,Yes
6239,776345,GKN.L,2001-08-08,2001-08-07, GKN;,Brambles falls on debut but GKN gains AUTOMOBILES AND PARTS:, GKN; US;,GKN US,2023-03-30 23:22:20.289963,Yes
6240,776591,GKN.L,2001-08-10,2001-08-09, GKN;,GKN LEX COLUMN, GKN; US;,GKN US,2023-03-30 23:22:32.483333,Yes
6241,776606,GKN.L,2001-08-10,2001-08-09, GKN;,"GKN sees further automotive downturn CAUTIOUS WELCOME AS FIRST-HALF FIGURES
MATCH DOWNGRADED FORECASTS:", US; Nissan; Opel; St Louis; Standard & Poor's; GKN;,US Nissan Opel St Louis Standard Poor s GKN,2023-03-30 23:22:38.598076,No
6242,792748,GKN.L,2001-10-31,2001-10-30, GKN;,"GKN sheds 1,250 jobs", Automotive; GKN;,Automotive GKN,2023-03-30 23:22:49.787736,Yes
6243,823949,GKN.L,2002-04-16,2002-04-15, GKN;,"Plenty of good meat still remains on the rump: Peter Marsh reports on
aspirations and ambitions of Marcus Beresford as he steers a course for the
remaining parts of GKN:", GKN; UK; Merrill Lynch; US; Siemens; Boeing;,GKN UK Merrill Lynch US Siemens Boeing,2023-03-30 23:23:01.257514,Yes
6244,845882,GKN.L,2002-08-09,2002-08-08, GKN;,GKN LEX COLUMN, UK; GKN;,UK GKN,2023-03-30 23:23:12.424124,Yes
6245,845894,GKN.L,2002-08-09,2002-08-08, GKN;,GKN tops forecasts but outlook unclear, GKN; Merrill Lynch; UK;,GKN Merrill Lynch UK,2023-03-30 23:23:18.498686,No
6246,846637,GKN.L,2002-08-14,2002-08-13, GKN;,GKN pensions deficit increases, GKN;,GKN,2023-03-30 23:23:24.544648,No
6247,853103,GKN.L,2002-09-20,2002-09-19, GKN;,GKN wins aircraft parts contract, GKN; Pratt; US;,GKN Pratt US,2023-03-30 23:23:35.694006,Yes
6248,853170,GKN.L,2002-09-20,2002-09-19, GKN;,GKN lands parts contract for US joint strike fighter, US; Pratt; Joint Strike Fighter; GKN; Lockheed Martin; BAE Systems; Pratt & Whitney; JSF; GKN Aerospace Services;,US Pratt Joint Strike Fighter GKN Lockheed Martin BAE Systems Pratt Whitney JSF GKN Aerospace Services,2023-03-31 10:15:51.480708,Yes
6249,871772,GKN.L,2002-12-20,2002-12-19, GKN;,"Smith takes over with a Lancashire lesson: GKN's new chief brings valuable
shop-floor knowhow to the post. Peter Marsh reports:", UK; BAE Systems; British Aerospace; GKN; US's; Brambles Industries;,UK BAE Systems British Aerospace GKN US s Brambles Industries,2023-03-31 10:15:58.528459,No
6250,871850,GKN.L,2002-12-20,2002-12-19, GKN;,GKN in push to lift helicopter sales in US, UK; US; Financial Times; GKN; BAE Systems; Lockheed Martin; Pentagon; United Technologies; US Air Force;,UK US Financial Times GKN BAE Systems Lockheed Martin Pentagon United Technologies US Air Force,2023-03-31 10:16:05.334984,No
6251,914290,GKN.L,2003-08-08,2003-08-07, GKN;,GKN lower as slowdown in US vehicle sales is set to intensify AUTOMOBILES:, US; City; Arbuthnot Securities; GKN;,US City Arbuthnot Securities GKN,2023-03-31 10:16:16.885722,Yes
6252,935668,GKN.L,2003-11-25,2003-11-24, GKN;,Baroness Hogg steps up to role of GKN deputy chairman AUTOMOBILES:, GKN;,GKN,2023-03-31 10:16:28.866275,Yes
6253,936536,GKN.L,2003-11-28,2003-11-27, GKN;,GKN to decide on base for research, Treasury; Financial Times; GKN; Department of Trade and Industry; England Development Agency;,Treasury Financial Times GKN Department of Trade and Industry England Development Agency,2023-03-31 10:16:35.339203,No
6254,938328,GKN.L,2003-12-08,2003-12-07, GKN;,"In search of that little bit of extra lift: AUTOMOBILES AND PARTS: Peter Marsh
finds Kevin Smith of GKN in confident mood as the group awaits the decision by
Boeing on its new 7E", US; Boeing; Airbus; GKN; Goldman Sachs; BAE Systems; Toyota;,US Boeing Airbus GKN Goldman Sachs BAE Systems Toyota,2023-03-31 10:16:47.506282,Yes
6255,940527,GKN.L,2003-12-17,2003-12-16, GKN;,UK & IRELAND: GKN in Pounds 90m goodwill write-off, US; GKN;,US GKN,2023-03-31 10:16:54.039128,No
6256,942627,GKN.L,2004-01-06,2004-01-05, GKN;,"The leadership legacy that has kept GKN aloft: MANAGEMENT: The British
engineer's success in reshaping itself provides a stark contrast with at least
one of its leading rivals, says Geoffrey Owen:", GKN; US; Financial Times; London School of Economics; Wincott Foundation;,GKN US Financial Times London School of Economics Wincott Foundation,2023-03-31 10:17:05.913296,Yes
6257,949151,GKN.L,2004-02-09,2004-02-08, GKN;,GKN awaits contract news, GKN; US;,GKN US,2023-03-31 10:17:20.666542,Yes
6258,952793,GKN.L,2004-02-26,2004-02-25, GKN;,GKN puts its former partner into the shade, UK; GKN; Boeing; US;,UK GKN Boeing US,2023-03-31 10:17:27.221520,No
6259,953633,GKN.L,2004-03-02,2004-03-01, GKN;,"GKN revamp threatens 2,000 jobs AUTOMOBILES:", UK; GKN;,UK GKN,2023-03-31 10:17:39.016946,Yes
6260,969285,GKN.L,2004-05-21,2004-05-20, GKN;,GKN set to sell stake, GKN;,GKN,2023-03-31 10:17:51.193464,Yes
6261,969343,GKN.L,2004-05-21,2004-05-20, GKN;,"GKN close to helicopter sale: Engineering group could reach agreement next week
on AgustaWestland deal with joint venture partner Finmeccanica", BAE Systems; US; General Dynamics; UK; Ministry of Defence; Boeing; GKN; AgustaWestland; Pier Francesco Guargualini;,BAE Systems US General Dynamics UK Ministry of Defence Boeing GKN AgustaWestland Pier Francesco Guargualini,2023-03-31 10:17:57.928732,No
6262,969363,GKN.L,2004-05-21,2004-05-20, GKN;,GKN's choices LOMBARD - MARTIN DICKSON, GKN; Goldman Sachs;,GKN Goldman Sachs,2023-03-31 10:18:09.813454,Yes
6263,969777,GKN.L,2004-05-26,2004-05-25, GKN;,Deal on GKN expected, GKN;,GKN,2023-03-31 10:18:21.822767,Yes
6264,969820,GKN.L,2004-05-26,2004-05-25, GKN;,Finmeccanica to seal GKN deal, GKN; EADS; Pier Francesco Guarguaglini; UK; UK Ministry of Defence; NH Industries;,GKN EADS Pier Francesco Guarguaglini UK UK Ministry of Defence NH Industries,2023-03-31 10:18:33.283852,Yes
6265,970359,GKN.L,2004-05-27,2004-05-26, GKN;,GKN to boost auto and aerospace arms, GKN; Standard & Poor's;,GKN Standard Poor s,2023-03-31 10:18:39.739708,No
6266,975435,GKN.L,2004-06-23,2004-06-22, GKN;,GKN to reduce debt after German sale NEWS DIGEST, Eaton Corporation; US for; GKN;,Eaton Corporation US for GKN,2023-03-31 10:18:46.029322,No
6267,983985,GKN.L,2004-08-06,2004-08-05, GKN;,GKN remains positive amid falls, GKN;,GKN,2023-03-31 10:18:52.256149,No
6268,985614,GKN.L,2004-08-17,2004-08-16, GKN;,GKN sells stake in Aerosystems NEWS DIGEST, BAE Systems; GKN; Marsh;,BAE Systems GKN Marsh,2023-03-31 10:18:58.474681,No
6269,986584,GKN.L,2004-08-23,2004-08-22, GKN;,OFT to probe GKN's AgustaWestland sale NEWS DIGEST, Office of Fair Trading; GKN; OFT;,Office of Fair Trading GKN OFT,2023-03-31 10:19:04.692540,No
6270,988337,GKN.L,2004-09-03,2004-09-02, GKN;,GKN revives its interest in Boeing facility AUTOMOBILES:, Wichita; US; UK; Boeing; Goldman Sachs; Vought Aircraft Industries; Carlyle Group; GKN; Airbus; Pentagon;,Wichita US UK Boeing Goldman Sachs Vought Aircraft Industries Carlyle Group GKN Airbus Pentagon,2023-03-31 10:19:11.136412,No
6271,1004436,GKN.L,2004-12-14,2004-12-13, GKN;,Disposal boosts GKN's financial firepower, GKN; Boeing; Wichita; Arden Partners; Deutsche Bank; US; UK;,GKN Boeing Wichita Arden Partners Deutsche Bank US UK,2023-03-31 10:19:17.504279,No
6272,1014809,GKN.L,2005-02-25,2005-02-24, GKN;,GKN gets underlying lift from upturn on aerospace side, US; Airbus; GKN;,US Airbus GKN,2023-03-31 10:19:23.821422,No
6273,1039568,GKN.L,2005-08-05,2005-08-04, GKN;,Raw material costs fail to dent GKN figures, GKN;,GKN,2023-03-31 10:19:35.548488,Yes
6274,1070149,GKN.L,2006-03-01,2006-02-28, GKN;,Strong aerospace showing propels GKN AUTOMOBILES & PARTS, GKN; US; US Navy;,GKN US US Navy,2023-03-31 10:19:46.806316,Yes
6275,1081704,GKN.L,2006-05-15,2006-05-14, GKN;,Baroness Hogg retires from GKN PEOPLE, Trinity Mirror; GKN;,Trinity Mirror GKN,2023-03-31 10:19:53.029810,No
6276,1099238,GKN.L,2006-09-20,2006-09-19, GKN;,GKN drops on profit concerns LONDON, US; GKN; Chrysler; General Motors; House; UBS; Energy; Bear Stearns; National Association of US Housebuilders; Morgan Stanley;,US GKN Chrysler General Motors House UBS Energy Bear Stearns National Association of US Housebuilders Morgan Stanley,2023-03-31 10:19:59.552005,No
6277,1099322,GKN.L,2006-09-20,2006-09-19, GKN;,GKN feels pressure from concern that it too might issue warning LONDON, US; GKN; Chrysler; Energy; Bear Stearns; National Association of US Housebuilders; Morgan Stanley; HBOS; Henderson Equity Partners; Rank Group;,US GKN Chrysler Energy Bear Stearns National Association of US Housebuilders Morgan Stanley HBOS Henderson Equity Partners Rank Group,2023-03-31 10:20:10.451512,No
6278,1113396,GKN.L,2006-12-20,2006-12-19, GKN;,GKN aborts talks with Visteon NEWS DIGEST, US; GKN; Ford Motor;,US GKN Ford Motor,2023-03-31 10:20:16.694863,No
6279,1123143,GKN.L,2007-02-28,2007-02-27, GKN;,"How to engineer a restructuring Toby Shelley looks at GKN's moves to defy a
distressed sector and build a profitable brand", US; GKN; Boeing;,US GKN Boeing,2023-03-31 10:20:22.918738,No
6280,1123144,GKN.L,2007-02-28,2007-02-27, GKN;,GKN buoyed by impressive results AUTOMOBILES & PARTS, US Sinter; GKN; UBS;,US Sinter GKN UBS,2023-03-31 10:20:29.221477,No
6281,1145898,GKN.L,2007-08-03,2007-08-02, GKN;,Weak dollar costs GKN Pounds 90m in sales, GKN; Airbus; Bristol;,GKN Airbus Bristol,2023-03-31 10:20:40.467660,Yes
6282,1169847,GKN.L,2007-12-14,2007-12-13, GKN;,Concern over US exposure at GKN, US; GKN;,US GKN,2023-03-31 10:20:52.240279,Yes
6283,1183335,GKN.L,2008-02-29,2008-02-28, GKN;,GKN boosted by Airbus plant buy, UK; Airbus; US; Boeing; GKN Aerospace; GKN;,UK Airbus US Boeing GKN Aerospace GKN,2023-03-31 10:21:03.606629,Yes
6284,1183485,GKN.L,2008-02-29,2008-02-28, GKN;,GKN cleared for take-off with Airbus wing plant, Airbus; Bristol; GKN;,Airbus Bristol GKN,2023-03-31 10:21:15.279450,Yes
6285,1208495,GKN.L,2008-07-23,2008-07-22, GKN;,GKN wins Brazil aircraft contract, UK; GKN;,UK GKN,2023-03-31 10:21:21.650393,No
6286,1216762,GKN.L,2008-09-16,2008-09-15, GKN;,Airbus sells UK plant to GKN, Airbus; GKN; Airbus UK;,Airbus GKN Airbus UK,2023-03-31 10:21:33.336478,Yes
6287,1216832,GKN.L,2008-09-16,2008-09-15, GKN;,Airbus sells UK wing plant to GKN, GKN; Airbus; Airbus UK; GKN Aerospace;,GKN Airbus Airbus UK GKN Aerospace,2023-03-31 10:21:44.998473,Yes
6288,1224240,GKN.L,2008-10-28,2008-10-27, GKN;,GKN to cut staff as car demand falls, GKN; UK; Boeing; Group; Evolution Securities;,GKN UK Boeing Group Evolution Securities,2023-03-31 10:21:51.690326,No
6289,1239070,GKN.L,2009-01-29,2009-01-28, GKN;,GKN puts cash aside to pay for job cuts, UK; GKN;,UK GKN,2023-03-31 10:22:03.823153,Yes
6290,1261184,GKN.L,2009-06-19,2009-06-18, GKN;,GKN launches £423m rights issue, Group; GKN; RBS Hoare Govett;,Group GKN RBS Hoare Govett,2023-03-31 10:22:13.346583,No
6291,1267563,GKN.L,2009-08-05,2009-08-04, GKN;,Cost cuts prompt recovery signs at GKN, GKN; Airbus;,GKN Airbus,2023-03-31 10:22:29.314116,Yes
6292,1286581,GKN.L,2009-12-17,2009-12-16, GKN;,GKN set to exceed market forecasts, GKN;,GKN,2023-03-31 10:22:40.809375,Yes
6293,1295727,GKN.L,2010-02-26,2010-02-25, GKN;,Recovering GKN plans pay-out resumption, GKN;,GKN,2023-03-31 10:22:52.360749,Yes
6294,1303847,GKN.L,2010-04-28,2010-04-27, GKN;,GKN profits and margins outlook reflects sector rebound, GKN;,GKN,2023-03-31 10:22:58.811242,No
6295,1315887,GKN.L,2010-07-30,2010-07-29, GKN;,GKN engineers a return to better times, UK; Land Systems; GKN; Sir; GM; Nissan; Bristol;,UK Land Systems GKN Sir GM Nissan Bristol,2023-03-31 10:23:10.575664,Yes
6296,1343167,GKN.L,2011-03-02,2011-03-01, GKN;,Strong new car market lifts GKN, GKN; BMW; Audi; Evolution Securities;,GKN BMW Audi Evolution Securities,2023-03-31 10:23:16.957148,No
6297,1344653,GKN.L,2011-03-14,2011-03-13, GKN;,GKN reaps rewards of change in direction, Group; GKN; Airbus; GKN Aerospace; Bristol; Boeing; Audi; BAE Systems; Northrop Grumman; US Navy; GM; Nissan; Fiat; UK; Wales;,Group GKN Airbus GKN Aerospace Bristol Boeing Audi BAE Systems Northrop Grumman US Navy GM Nissan Fiat UK Wales,2023-03-31 10:23:23.607158,No
6298,1345924,GKN.L,2011-03-23,2011-03-22, GKN;,GKN slides on talk of Latécoère interest, GKN; Toyota; Honda; Man Group; WPP; BNP Paribas;,GKN Toyota Honda Man Group WPP BNP Paribas,2023-03-31 10:23:35.465864,Yes
6299,1345961,GKN.L,2011-03-23,2011-03-22, GKN;,GKN tumbles on speculation it has joined race to buy Latécoère, GKN; Latécoère; Airbus; Toyota; Honda; Man Group; WPP; BNP Paribas; Vedanta Resources; Barclays Capital; Rank Group; 13.5; Mitchells & Butlers; HMV Group; Caza Oil & Gas;,GKN Latécoère Airbus Toyota Honda Man Group WPP BNP Paribas Vedanta Resources Barclays Capital Rank Group Mitchells Butlers HMV Group Caza Oil Gas,2023-03-31 10:23:42.022368,No
6300,1346414,GKN.L,2011-03-25,2011-03-24, GKN;,GKN succession path runs smooth to Stein, UK; Toyota; Volkswagen; Arden Partners; GKN; BAE Systems; Airbus; Evolution Securities;,UK Toyota Volkswagen Arden Partners GKN BAE Systems Airbus Evolution Securities,2023-03-31 10:23:53.796016,Yes
6301,1348679,GKN.L,2011-04-12,2011-04-11, GKN;,GKN sees improvement in demand, GKN; Mitsubishi;,GKN Mitsubishi,2023-03-31 10:24:05.367423,Yes
6302,1359589,GKN.L,2011-07-08,2011-07-07, GKN;,GKN moves ahead on Chinese bid talk, GKN; Shanghai; Automotive Industry Corporation; MG; US; UK; Man Group; Nomura Securities;,GKN Shanghai Automotive Industry Corporation MG US UK Man Group Nomura Securities,2023-03-31 10:24:17.028972,Yes
6303,1359618,GKN.L,2011-07-08,2011-07-07, GKN;,Takeover talk boosts GKN as FTSE 100 hits two-month high, GKN; Shanghai; Automotive Industry Corporation; MG; US; UK; Man Group; Nomura Securities; Capital Shopping; Liberum Capital; Procter & Gamble; British Sky Broadcasting; FT; News Corp's; Goldman Sachs; Pace; Dunelm Group; Malaysian; Chariot Oil & Gas;,GKN Shanghai Automotive Industry Corporation MG US UK Man Group Nomura Securities Capital Shopping Liberum Capital Procter Gamble British Sky Broadcasting FT News Corp s Goldman Sachs Pace Dunelm Group Malaysian Chariot Oil Gas,2023-03-31 10:24:23.767068,No
6304,1362526,GKN.L,2011-08-02,2011-08-01, GKN;,GKN bucks weak trend as engineer gets backing for its growth targets, UBS; 250p; GKN; Airbus; US; US's; Lloyds Banking Group; Royal Bank; HSBC; Kofax; Data Electronics Group; Data Electronics; Deutsche Bank; Spirit Group; Shandong Iron & Steel Group; XX Small;,UBS p GKN Airbus US US s Lloyds Banking Group Royal Bank HSBC Kofax Data Electronics Group Data Electronics Deutsche Bank Spirit Group Shandong Iron Steel Group XX Small,2023-03-31 10:24:30.668328,No
6305,1362548,GKN.L,2011-08-02,2011-08-01, GKN;,Aerospace growth hopes help lift GKN, UBS; 250p; GKN; Airbus; US; Lloyds Banking Group; Royal Bank; HSBC; XX Small;,UBS p GKN Airbus US Lloyds Banking Group Royal Bank HSBC XX Small,2023-03-31 10:24:37.028964,No
6306,1372089,GKN.L,2011-10-20,2011-10-19, GKN;,GKN chief calls for clear UKstrategy, GKN;,GKN,2023-03-31 10:24:48.868269,Yes
6307,1387454,GKN.L,2012-02-29,2012-02-28, GKN;,GKN, GKN; Volvo;,GKN Volvo,2023-03-31 10:25:00.358015,Yes
6308,1387456,GKN.L,2012-02-29,2012-02-28, GKN;,GKN looking forward to year of good progress, GKN; Global; Boeing; Airbus; US;,GKN Global Boeing Airbus US,2023-03-31 10:25:17.563501,Yes
6309,1393273,GKN.L,2012-04-19,2012-04-18, GKN;,Aircraft and car demand boost GKN, UK; Global; Boeing; Airbus; GKN; Credit Suisse; Volvo;,UK Global Boeing Airbus GKN Credit Suisse Volvo,2023-03-31 10:25:23.809231,No
6310,1402793,GKN.L,2012-07-06,2012-07-05, GKN;,GKN, GKN.; UK; Volvo; GKN; Volvo Aero; US (;,GKN UK Volvo GKN Volvo Aero US,2023-03-31 10:25:34.292205,Yes
6311,1405933,GKN.L,2012-08-07,2012-08-06, GKN;,GKN deal with Volvo pays off as re-rating comments provide a lift, Volvo; Volvo Aero; GKN; Royal Bank; FTSE; US subsidiary; Merrill Lynch; Citizens; RBS; Barclays; Lloyds Banking Group; Standard Chartered; US; Capital.; Deutsche Bank; UK; Goldman Sachs; Bloomsbury Publishing;,Volvo Volvo Aero GKN Royal Bank FTSE US subsidiary Merrill Lynch Citizens RBS Barclays Lloyds Banking Group Standard Chartered US Capital Deutsche Bank UK Goldman Sachs Bloomsbury Publishing,2023-03-31 10:25:46.031508,Yes
6312,1428211,GKN.L,2013-02-27,2013-02-26, GKN;,Profits up but GKN cautions on future, Strong; GKN; Boeing;,Strong GKN Boeing,2023-03-31 10:25:57.435227,Yes
6313,1444960,GKN.L,2013-07-26,2013-07-25, GKN;,GKN hit by speculation about fundraising for US acquisition, US; Boeing; GKN; GKN Aerospace; Volvo; Arm Holdings; Goldman Sachs; AZ Electronic Materials; Deutsche Bank;,US Boeing GKN GKN Aerospace Volvo Arm Holdings Goldman Sachs AZ Electronic Materials Deutsche Bank,2023-03-31 10:26:09.273925,Yes
6314,1445413,GKN.L,2013-07-31,2013-07-30, GKN;,GKN focus on aviation sees results take off, GKN; British; Boeing; Airbus; Volvo; US;,GKN British Boeing Airbus Volvo US,2023-03-31 10:26:20.641798,Yes
6315,1570404,GKN.L,2017-06-16,2017-06-15, GKN;,Corrections: Dauren Karabayev; GKN, GKN;,GKN,2023-03-31 10:26:32.007928,Yes
6316,1594078,GKN.L,2017-10-24,2017-10-23, GKN;,London Revival of GKN break-up talk nudges FTSE 100 higher, GKN; UK; SAIC Motor Corporation; FTSE; Dialight; CRH; US;,GKN UK SAIC Motor Corporation FTSE Dialight CRH US,2023-03-31 10:26:43.990221,Yes
6317,1598544,GKN.L,2017-11-17,2017-11-16, GKN;,GKN plans up in the air following U-turn on newly appointed chief, GKN; US;,GKN US,2023-03-31 10:26:56.441878,Yes
