,article_id,Code,Date,Date_lag,Company,headline,orgs_mentioned,key_phrase,save_time,online_found
6678,1533241,GSK.L,2016-03-18,2016-03-17, GSK;,GSK: wheel of fortune, FTSE; Pfizer; GSK;,FTSE Pfizer GSK,2023-03-31 11:23:47.582300,No
6679,1533258,GSK.L,2016-03-18,2016-03-17, GSK;,Witty defends GSK structure to the end as exit sparks speculation over break-up, Financial Times; US; White House; GSK;,Financial Times US White House GSK,2023-03-31 11:23:53.598678,No
6680,1534015,GSK.L,2016-04-01,2016-03-31, GSK;,GSK raises developing world access to its drugs by allowing low-cost copies, UK; GSK; World Bank; Group;,UK GSK World Bank Group,2023-03-31 11:23:59.561270,No
6681,1544366,GSK.L,2016-08-02,2016-08-01, GSK;,GSK joins Alphabet to develop 'third way' of bioelectronic disease control, Verily Life Sciences; Google Life Sciences; GSK; UK;,Verily Life Sciences Google Life Sciences GSK UK,2023-03-31 11:24:08.748939,No
6682,1547845,GSK.L,2016-09-21,2016-09-20, GSK;,GSK picks consumer head Walmsley to succeed Witty as chief executive, GSK;,GSK,2023-03-31 11:24:17.891674,No
6683,1566008,GSK.L,2017-04-27,2017-04-26, GSK;,GlaxoSmithKline: continuity candidate, GSK;,GSK,2023-03-31 11:24:27.051203,No
6684,1567091,GSK.L,2017-05-12,2017-05-11, GSK;,GSK buoyed by air delay, US Food and Drug Administration; FDA; GSK;,US Food and Drug Administration FDA GSK,2023-03-31 11:24:36.235249,No
6685,1595134,GSK.L,2017-10-27,2017-10-26, GSK;,London GSK hits 18-month low following fears over dividend, Merrill Lynch; Merrill; GSK; US; BNP Paribas; US Marketplace; National Express; JD Sports; Nike; Sirius Minerals; PT Chemical Indonesia;,Merrill Lynch Merrill GSK US BNP Paribas US Marketplace National Express JD Sports Nike Sirius Minerals PT Chemical Indonesia,2023-03-31 11:24:45.617876,No
