,article_id,Code,Date,Date_lag,Company,headline,orgs_mentioned,key_phrase,save_time,online_found
13239,725023,RTO.L,2000-11-23,2000-11-22, Rentokil;,"COMPANIES & FINANCE UK AND IRELAND: Rentokil chief says group has 'turned
corner'", UBS Warburg;,UBS Warburg,2023-04-04 12:33:47.313779,Yes
13240,825714,RTO.L,2002-04-23,2002-04-22, Rentokil;,"Axemen needed to dismember empires: Andrea Felsted looks at the similar searches
by Hays and Rentokil Initial for replacement chief executives:", Deutsche Post; UK; UBS Warburg;,Deutsche Post UK UBS Warburg,2023-04-04 12:33:58.575209,Yes
13241,825714,RTO.L,2002-04-23,2002-04-22, Rentokil;,"Axemen needed to dismember empires: Andrea Felsted looks at the similar searches
by Hays and Rentokil Initial for replacement chief executives:", Deutsche Post; UK; UBS Warburg;,Deutsche Post UK UBS Warburg,2023-04-04 12:34:09.734724,Yes
13242,881214,RTO.L,2003-02-14,2003-02-13, Rentokil;,"Rentokil takes a walk on the Wilde side: New chief is keen to make his mark on
the business services group and step out of his predecessor's shadow, say", UK; BET;,UK BET,2023-04-04 12:34:21.690571,Yes
13243,937400,RTO.L,2003-12-03,2003-12-02, Rentokil Initial;,Rentokil shares down 6% on update SUPPORT SERVICES:, Rentokil Initial;,Rentokil Initial,2023-04-04 12:34:27.667369,No
13244,969039,RTO.L,2004-05-20,2004-05-19, Rentokil;,Rentokil shares tumble as board forces Thompson out, 2m;,m,2023-04-04 12:34:39.742209,Yes
13245,970356,RTO.L,2004-05-27,2004-05-26, Rentokil;,McGowan poised for Rentokil review, Phoenix Equity Partners; Merrill Lynch;,Phoenix Equity Partners Merrill Lynch,2023-04-04 12:34:50.800733,Yes
13246,987374,RTO.L,2004-08-27,2004-08-26, Rentokil;,Rentokil refuses sell-off despite 10% profits fall, Webster;,Webster,2023-04-04 12:35:01.968212,Yes
13247,993963,RTO.L,2004-10-11,2004-10-10, Rentokil;,Rentokil set to decide on linen businesses SUPPORT SERVICES:, UK; Merrill Lynch;,UK Merrill Lynch,2023-04-04 12:35:08.158679,No
13248,1012159,RTO.L,2005-02-08,2005-02-07, Rentokil Initial;,Flynn's task to get Rentokil in focus, Rentokil Initial;,Rentokil Initial,2023-04-04 12:35:19.784226,Yes
13249,1041560,RTO.L,2005-08-24,2005-08-23, Rentokil;,Sir Gerry uses Europa for Rentokil move, Europa Partners; 71.5; UK; Warburg; Dillon Read and Swiss Bank Corporation; Early Learning Centre; Royal London Private Equity;,Europa Partners UK Warburg Dillon Read and Swiss Bank Corporation Early Learning Centre Royal London Private Equity,2023-04-04 12:35:26.050065,No
13250,1043939,RTO.L,2005-09-09,2005-09-08, Rentokil;,Rentokil spurns Robinson offer, Deutsche Bank;,Deutsche Bank,2023-04-04 12:35:38.726819,Yes
13251,1044761,RTO.L,2005-09-15,2005-09-14, Rentokil;,"Clock is ticking for the Sir Gerry show Plush presentationby Rentokil's suitor
falls flat with analysts, writes Salamander Davoudi", City; LWT;,City LWT,2023-04-04 12:35:44.882027,No
13252,1045044,RTO.L,2005-09-16,2005-09-15, Rentokil;,Sir Gerry in with 'very real chance' of Rentokil success SUPPORT SERVICES, Lehman Brothers; Raphoe Management; Rentokil; Deutsche Bank;,Lehman Brothers Raphoe Management Rentokil Deutsche Bank,2023-04-04 12:35:51.073671,No
13253,1047911,RTO.L,2005-10-05,2005-10-04, Rentokil;,Sir Gerry strangely quiet on Rentokil front SUPPORT SERVICES, Raphoe Management; US;,Raphoe Management US,2023-04-04 12:35:57.210959,No
13254,1049763,RTO.L,2005-10-17,2005-10-16, Rentokil;,High Noon deadline as Rentokil investors await Sir Gerry SUPPORT SERVICES, Allied Domecq;,Allied Domecq,2023-04-04 12:36:08.845462,Yes
13255,1050143,RTO.L,2005-10-18,2005-10-17, Rentokil;,Robinson drops bid for Rentokil, Deutsche Bank;,Deutsche Bank,2023-04-04 12:36:28.599282,Yes
13256,1050258,RTO.L,2005-10-20,2005-10-19, Rentokil;,Sir Gerry's Rentokil bid moves up a notch, Rentokil;,Rentokil,2023-04-04 12:36:39.916108,Yes
13257,1064698,RTO.L,2006-01-25,2006-01-24, Rentokil;,Rentokil buys US hygiene rival for Dollars 142m SUPPORT SERVICES, US; Ecolab; Rentokil;,US Ecolab Rentokil,2023-04-04 12:36:46.090292,No
13258,1067313,RTO.L,2006-02-09,2006-02-08, Rentokil;,Security firms line up to buyRentokil division SUPPORT SERVICES, UK; US;,UK US,2023-04-04 12:37:02.755123,Yes
13259,1069477,RTO.L,2006-02-24,2006-02-23, Rentokil;,Depressed Rentokil warns of growth delay, UK; Rentokil;,UK Rentokil,2023-04-04 12:37:08.951192,No
13260,1095331,RTO.L,2006-08-18,2006-08-17, Rentokil;,Rentokil rally grinds to a halt after house broker downgrade LONDON, Morgan Stanley; Goldman Sachs; British Airways; Royal Dutch Shell; BG Group 1; Merrill Lynch; Corus Group; MFI Furniture; GCap Media; US; Gyrus Group; ABN Amro;,Morgan Stanley Goldman Sachs British Airways Royal Dutch Shell BG Group Merrill Lynch Corus Group MFI Furniture GCap Media US Gyrus Group ABN Amro,2023-04-04 12:37:15.262259,No
13261,1146623,RTO.L,2007-08-09,2007-08-08, Rentokil;,Rentokil on the up as Merrill forecasts return to growth, Merrill Lynch; Merrill; F&C Asset Management; Berggruen Holdings; Standard Life; National Australia Bank; Clydesdale Bank; Royal & Sun Alliance; Admiral Group; Guardian Media Group; Apax Partners; Ashmore Group; Evolution Securities; IPO; Smiths Group; FKI;,Merrill Lynch Merrill F C Asset Management Berggruen Holdings Standard Life National Australia Bank Clydesdale Bank Royal Sun Alliance Admiral Group Guardian Media Group Apax Partners Ashmore Group Evolution Securities IPO Smiths Group FKI,2023-04-04 12:37:27.587477,Yes
13262,1193129,RTO.L,2008-04-22,2008-04-21, Rentokil;,Rentokil warns on City Link parcel business, City Link; Target Express; Tower;,City Link Target Express Tower,2023-04-04 12:37:39.713530,Yes
