,article_id,Code,Date,Date_lag,Company,headline,orgs_mentioned,key_phrase,save_time,online_found
16033,708618,VOD.L,2000-09-05,2000-09-04, Vodafone Group;,STOCK MARKETS LONDON STOCK EXCHANGE: Weak Vodafone proves a drag on FTSE 100, FTSE; Labor; CSFB; Vodafone Group;,FTSE Labor CSFB Vodafone Group,2023-04-06 12:26:30.799353,Yes
16034,708737,VOD.L,2000-09-06,2000-09-05, Vodafone;,SHORTS: Hutchison may sell Vodafone stake, Vodafone; UK;,Vodafone UK,2023-04-06 12:26:44.316125,Yes
16035,708812,VOD.L,2000-09-06,2000-09-05, Vodafone;,FRONT PAGE - COMPANIES & MARKETS: Hutchison may sell stake in Vodafone, UK;,UK,2023-04-06 12:27:01.932295,Yes
16036,717871,VOD.L,2000-10-20,2000-10-19, Vodafone Group;,STOCK MARKETS LONDON STOCK EXCHANGE: Vodafone deal lifts Atlantic, Atlantic Telecom; Vodafone Group; BT; Vodafone-Atlantic Telecom; British Telecommunications; Sema Group; Top Shop and Dorothy Perkins; Boeing; US for; US; Deutsche Bank;,Atlantic Telecom Vodafone Group BT Vodafone Atlantic Telecom British Telecommunications Sema Group Top Shop and Dorothy Perkins Boeing US for US Deutsche Bank,2023-04-06 12:27:10.263359,No
16037,720553,VOD.L,2000-11-02,2000-11-01, Vodafone Group;,STOCK MARKETS LONDON STOCK EXCHANGE: Telecom rout hits Vodafone, US; Vodafone Group; Cable & Wireless; American Petroleum Institute; Shell Transport; Berkshire Hathaway Group; CBI Survey; BSS Group; Barclays; Royal Bank; Merrill Lynch; Herald Investment Trust;,US Vodafone Group Cable Wireless American Petroleum Institute Shell Transport Berkshire Hathaway Group CBI Survey BSS Group Barclays Royal Bank Merrill Lynch Herald Investment Trust,2023-04-06 12:27:23.632811,Yes
16038,720782,VOD.L,2000-11-03,2000-11-02, Vodafone Group;,STOCK MARKETS LONDON STOCK EXCHANGE: Vodafone price in tatters, Vodafone Group; US; UBS Warburg; Shell Transport; ICI; British Airways; KLM; Land Securities; UK; FTSE; Trillium Investments; Department of Social Security; Hilton Group; Goldman Sachs; HSBC USA; HSBC; Merrill Lynch; Pace Micro; Credit Suisse First Boston;,Vodafone Group US UBS Warburg Shell Transport ICI British Airways KLM Land Securities UK FTSE Trillium Investments Department of Social Security Hilton Group Goldman Sachs HSBC USA HSBC Merrill Lynch Pace Micro Credit Suisse First Boston,2023-04-06 12:27:31.798410,No
16039,721674,VOD.L,2000-11-08,2000-11-07, Vodafone Group;,"STOCK MARKETS LONDON STOCK EXCHANGE: Vodafone drives FTSE 100 higher at the
close", US; Nasdaq Composite; Vodafone Group; UK; British Telecom; Merrill Lynch; Colt Telecom;,US Nasdaq Composite Vodafone Group UK British Telecom Merrill Lynch Colt Telecom,2023-04-06 12:27:51.284664,Yes
16040,722564,VOD.L,2000-11-13,2000-11-12, Vodafone;,"FRONT PAGE - COMPANIES & MARKETS: BT may sue Vodafone, Vivendi: Bid to halt
launch of portal in France fails but ruling leaves door open for damages claim", British Telecommunications; BT; Vodafone;,British Telecommunications BT Vodafone,2023-04-06 12:27:59.269640,No
16041,726102,VOD.L,2000-11-29,2000-11-28, Vodafone Group;,STOCK MARKETS LONDON STOCK EXCHANGE: Vodafone falls on rumour, Vodafone Group; Colt Telecom; TeleWest Communications; Cable & Wireless; Kingston Communications; Sema Group; UK; US; Bookham Technologies; IT; Financial Services Authority; Credit Suisse First Boston; HSBC Securities; ABN Amro; Life Sciences; Trinity Mirror; National Australia Bank; Lloyds TSB.; Lloyds; UBS Warburg;,Vodafone Group Colt Telecom TeleWest Communications Cable Wireless Kingston Communications Sema Group UK US Bookham Technologies IT Financial Services Authority Credit Suisse First Boston HSBC Securities ABN Amro Life Sciences Trinity Mirror National Australia Bank Lloyds TSB Lloyds UBS Warburg,2023-04-06 12:28:07.648062,No
16042,728205,VOD.L,2000-12-08,2000-12-07, Vodafone;,"FRONT PAGE - COMPANIES & MARKETS: Gent mission to steady Vodafone shares:
Hutchison promises structured sale of 2.5% stake to help calm markets", Morgan Stanley Dean Witter; Vodafone; BSCH;,Morgan Stanley Dean Witter Vodafone BSCH,2023-04-06 12:28:15.619305,No
16043,728288,VOD.L,2000-12-08,2000-12-07, Vodafone;,"COMPANIES & FINANCE: UK: Vodafone chief flies to HK TELECOMMUNICATION SERVICES
GENT WISHES TO DISCUSS SALE OF HUTCHISON WHAMPOA'S 2.5% STAKE:", Morgan Stanley Dean Witter; Vodafone; BSCH;,Morgan Stanley Dean Witter Vodafone BSCH,2023-04-06 12:28:23.707788,No
16044,728622,VOD.L,2000-12-12,2000-12-11, Vodafone;,"COMPANIES & FINANCE ASIA-PACIFIC: Vodafone's JT move may add muscle to Japanese
market: The UK group is eyeing an eastern jewel, writes Michiyo Nakamoto:", UK; Mitsubishi Securities; US; J-Phone; Credit Suisse First Boston Securities; British Telecommunications;,UK Mitsubishi Securities US J Phone Credit Suisse First Boston Securities British Telecommunications,2023-04-06 12:28:36.986399,Yes
16045,731627,VOD.L,2000-12-29,2000-12-28, Vodafone;,"STOCK MARKETS LONDON STOCK EXCHANGE: Vodafone retreat applies the brakes to
Footsie", FTSE SmallCap; Nasdaq Composite; Nasdaq;,FTSE SmallCap Nasdaq Composite Nasdaq,2023-04-06 12:28:57.434674,Yes
16046,732179,VOD.L,2001-01-04,2001-01-03, Vodafone;,STOCK MARKETS LONDON STOCK EXCHANGE: Overhang fears hit Vodafone, Cable & Wireless; UK; US; Shell Transport; Deutsche Bank; Goldman Sachs; Societe Generale and Credit Suisse; Hilton; Lehman Brothers; Salomon Smith Barney; Merrill Lynch;,Cable Wireless UK US Shell Transport Deutsche Bank Goldman Sachs Societe Generale and Credit Suisse Hilton Lehman Brothers Salomon Smith Barney Merrill Lynch,2023-04-06 12:29:05.620927,No
16047,733035,VOD.L,2001-01-09,2001-01-08, Vodafone;,"FRONT PAGE - COMPANIES & MARKETS: Hutchison sell-off hits Vodafone: Telecom
group falls 6% after HK conglomerate cuts stake", US; Merrill Lynch; Goldman Sachs; UK;,US Merrill Lynch Goldman Sachs UK,2023-04-06 12:29:19.246365,Yes
16048,743073,VOD.L,2001-02-28,2001-02-27, Vodafone;,STOCK MARKETS LONDON STOCK EXCHANGE: Japanese cheer for Vodafone, BT; US; Nasdaq; ARM Holdings; Bookham Technology; MTV; Standard Chartered; Deutsche Bank; Deutsche; Hilton; Dairy Crest; Morgan Stanley Dean Witter;,BT US Nasdaq ARM Holdings Bookham Technology MTV Standard Chartered Deutsche Bank Deutsche Hilton Dairy Crest Morgan Stanley Dean Witter,2023-04-06 12:29:32.787148,Yes
16049,748605,VOD.L,2001-03-23,2001-03-22, Vodafone;,"COMPANIES & FINANCE INTERNATIONAL: Germany casts some light on takeover law:
Reeling from the Vodafone/Mannesmann ordeal, Berlin is playing catch-up with the
rest of Europe and is introducing rules on unsolicited bids", Germany; It; Shearman; Deutsche Bank; Deutschland AG; UK; Allen & Overy;,Germany It Shearman Deutsche Bank Deutschland AG UK Allen Overy,2023-04-06 12:29:40.782944,No
16050,749294,VOD.L,2001-03-27,2001-03-26, Vodafone;,COMPANIES & FINANCE UK: Vodafone to cut pre-pay subsidies, Deutsche Telekom; France Telecom;,Deutsche Telekom France Telecom,2023-04-06 12:29:54.679839,Yes
16051,753908,VOD.L,2001-04-20,2001-04-19, Vodafone;,SHORTS: Vodafone and BT set for J-Phone duel, BT;,BT,2023-04-06 12:30:07.781072,Yes
16052,756575,VOD.L,2001-05-03,2001-05-02, Vodafone;,"Investors welcome Vodafone issue for J-Phone purchase: Market reaction gives
cause for optimism in battered telecoms sector", BT; UK; Japan Telecom; JT; Y2.37m;,BT UK Japan Telecom JT Y m,2023-04-06 12:30:15.774566,No
16053,756582,VOD.L,2001-05-03,2001-05-02, Vodafone;,"Bulk buying of advice brings Vodafone rich rewards: Dan Roberts on the
investment banks and their teams behind the group's deals:", Goldman Sachs; UBS Warburg; Goldman; US;,Goldman Sachs UBS Warburg Goldman US,2023-04-06 12:30:29.290812,Yes
16054,756615,VOD.L,2001-05-03,2001-05-02, Vodafone;,Vodafone blow to telecoms recovery WORLD OVERVIEW, UK; British Telecom; US; Nasdaq Composite; Salomon Smith Barney; Morgan;,UK British Telecom US Nasdaq Composite Salomon Smith Barney Morgan,2023-04-06 12:30:37.535553,No
16055,760729,VOD.L,2001-05-23,2001-05-22, Vodafone;,Nortel lands Vodafone deal NEWS DIGEST, Vodafone; Nortel;,Vodafone Nortel,2023-04-06 12:30:45.517429,No
16056,762076,VOD.L,2001-05-30,2001-05-29, Vodafone Group;,Vodafone stays out of race NEWS DIGEST, Vodafone Group; Pacific Century CyberWorks; Singapore Press Holdings; Cable; PCCW;,Vodafone Group Pacific Century CyberWorks Singapore Press Holdings Cable PCCW,2023-04-06 12:30:53.539440,No
16057,763286,VOD.L,2001-06-04,2001-06-03, Vodafone;,Vodafone on verge of SFR breakthrough, SFR; British Telecommunications; SBC Communications; US;,SFR British Telecommunications SBC Communications US,2023-04-06 12:31:08.823335,Yes
16058,765069,VOD.L,2001-06-13,2001-06-12, Vodafone;,Vodafone facing crunch, Vodafone; KPN; Deutsche Telekom; Sage Group; CML Microsystems; BP; Shell; BG Group; BG; BNP Paribas; Lloyds TSB; Lloyds; TSB; Standard Chartered; Lehman Brothers;,Vodafone KPN Deutsche Telekom Sage Group CML Microsystems BP Shell BG Group BG BNP Paribas Lloyds TSB Lloyds TSB Standard Chartered Lehman Brothers,2023-04-06 12:31:16.923492,No
16059,766391,VOD.L,2001-06-19,2001-06-18, Vodafone;,Vodafone and Microsoft link NEWS DIGEST, Microsoft; Lotus Notes;,Microsoft Lotus Notes,2023-04-06 12:31:24.901915,No
16060,766864,VOD.L,2001-06-21,2001-06-20, Vodafone;,Sell-off starts in Vodafone, Merrill Lynch; Credit Suisse First Boston; Reuters; CSFB; Carlton Communications; Communications; White Paper; Cable & Wireless; Lehman Brothers; US; Bookham Technology; ING Barings Charterhouse; UBS Warburg; BAT; US Justice; Imperial Tobacco; Royal & Sun Alliance; UK; British Airways; Merrill; Deutsche Bank;,Merrill Lynch Credit Suisse First Boston Reuters CSFB Carlton Communications Communications White Paper Cable Wireless Lehman Brothers US Bookham Technology ING Barings Charterhouse UBS Warburg BAT US Justice Imperial Tobacco Royal Sun Alliance UK British Airways Merrill Deutsche Bank,2023-04-06 12:31:33.082051,No
16061,768665,VOD.L,2001-06-29,2001-06-28, Vodafone;,Telecoms up on Vodafone news, Deutsche Telekom; KPN Telecom; ABN Amro; France Telecom; US; Royal Dutch; Ericsson; Deutsche Bank; JC Decaux; Credit Lyonnais Securities Europe; RCS Rizzoli Corriere; IPO; Lehman Brothers; RWE; SNS Securities;,Deutsche Telekom KPN Telecom ABN Amro France Telecom US Royal Dutch Ericsson Deutsche Bank JC Decaux Credit Lyonnais Securities Europe RCS Rizzoli Corriere IPO Lehman Brothers RWE SNS Securities,2023-04-06 12:31:46.524070,Yes
16062,769107,VOD.L,2001-07-02,2001-07-01, Vodafone Group;,FT Global 500 moves Libertel-Vodafone, Vodafone Group;,Vodafone Group,2023-04-06 12:32:00.674340,Yes
16063,772325,VOD.L,2001-07-18,2001-07-17, Vodafone;,Deutsche Bahn in Arcor deal with Vodafone, Deutsche Bahn; UK; DB; CNI;,Deutsche Bahn UK DB CNI,2023-04-06 12:32:08.664909,No
16064,773638,VOD.L,2001-07-25,2001-07-24, Vodafone Group;,Vodafone Japan names Morrow PEOPLE, Morrow  Vodafone Japan; US; Vodafone Group; Morrow; AirTouch Communications;,Morrow Vodafone Japan US Vodafone Group Morrow AirTouch Communications,2023-04-06 12:32:41.497138,Yes
16065,783760,VOD.L,2001-09-17,2001-09-16, Vodafone;,Vodafone moves on Japan Telecom, Japan Telecom  Vodafone; Japan Telecom;,Japan Telecom Vodafone Japan Telecom,2023-04-06 12:32:55.218069,Yes
16066,783839,VOD.L,2001-09-17,2001-09-16, Vodafone;,"Vodafone moves on Japan Telecom TELECOMMUNICATIONS SUPER-MAJORITY WOULD GIVE
ABILITY TO SET STRATEGY AT MOBILE OPERATOR J-PHONE:", Japan Telecom; JR East; JR West; JR Central; JT; JR;,Japan Telecom JR East JR West JR Central JT JR,2023-04-06 12:33:08.325675,Yes
16067,784963,VOD.L,2001-09-21,2001-09-20, Vodafone;,Vodafone offer aims to cement takeover, Japan Telecom; 21.7; JT; UBS Warburg;,Japan Telecom JT UBS Warburg,2023-04-06 12:33:31.776129,Yes
16068,808051,VOD.L,2002-01-23,2002-01-22, Vodafone;,"Vodafone's customer base tops 100m TELECOMMUNICATIONS INVESTORS CAUTIOUS AHEAD
OF BREAKDOWN OF FIGURES IN INDIVIDUAL MARKETS:", UK; US -; IPO;,UK US IPO,2023-04-06 12:33:39.736417,No
16069,822979,VOD.L,2002-04-11,2002-04-10, Vodafone;,Vodafone trading heats up, Vodafone; ABN Amro; Salomon Smith Barney; CAI Cheuvreux; ABN; US; Goldman Sachs; UBS; Morgan Sindall; JJB Sports; UBS Warburg; Merrill Lynch; Deutsche Bank; BNP Paribas; Reuters; UK; Communications; GWR;,Vodafone ABN Amro Salomon Smith Barney CAI Cheuvreux ABN US Goldman Sachs UBS Morgan Sindall JJB Sports UBS Warburg Merrill Lynch Deutsche Bank BNP Paribas Reuters UK Communications GWR,2023-04-06 12:33:47.936862,No
16070,831422,VOD.L,2002-05-24,2002-05-23, Vodafone;,"Vodafone hoping that its City connections can help to lift the telecoms gloom
THE MOBILE PHONE GIANT WILL NEED TO AVOID ANY NEGATIVE SURPRISES WHEN IT
PUBLISHES ITS FULL-YEAR RESULTS NEXT T:", Goldman Sachs; UBS Warburg; Cable; Deutsche Bank; Vodafone; Goldman;,Goldman Sachs UBS Warburg Cable Deutsche Bank Vodafone Goldman,2023-04-06 12:34:01.162045,Yes
16071,832111,VOD.L,2002-05-28,2002-05-27, Vodafone;,"Vodafone faces new protests over Gent's bonus: Telecoms group's shareholders
angry that CEO may receive lucrative award", Vodafone; US; Legal & General; Barclays Global Investors; Standard Life;,Vodafone US Legal General Barclays Global Investors Standard Life,2023-04-06 12:34:14.372343,Yes
16072,836386,VOD.L,2002-06-20,2002-06-19, Vodafone;,"Sir Christopher sends a big bill to shareholders: Charles Pretzlik and Richard
Waters analyse Vodafone's decision to reward its chief executive:", US; Deutsche Telekom; Prudential; Manchester-based Co-operative Insurance Society;,US Deutsche Telekom Prudential Manchester based Co operative Insurance Society,2023-04-06 12:34:27.477218,Yes
16073,836476,VOD.L,2002-06-20,2002-06-19, Vodafone;,"Vodafone confident on Gent deal CHIEF'S PACKAGE SET TO BECOME EXECUTIVE PAY
BENCHMARK: * INVESTORS EXPECTED TO AGREE DESPITE GREED ACCUSATIONS:", Deutsche Telekom; Hewitt Bacon; ABN Amro;,Deutsche Telekom Hewitt Bacon ABN Amro,2023-04-06 12:34:35.467944,No
16074,836493,VOD.L,2002-06-20,2002-06-19, Vodafone;,Vodafone throws down a pay challenge to City: Shareholders face three big issues, UK; US; BP; Vodafone;,UK US BP Vodafone,2023-04-06 12:34:48.677649,Yes
16075,840854,VOD.L,2002-07-15,2002-07-14, Vodafone;,Vodafone chief sues Telegraph NEWS DIGEST, High Court; Enron;,High Court Enron,2023-04-06 12:35:02.088539,Yes
16076,844253,VOD.L,2002-07-31,2002-07-30, Vodafone;,"Vodafone auditor fights sacking call: Andrew Parker, Tony Tassell and Martin
Arnold report on an activist's demand for corporate change:", Pensions Investment Research Consultants; Accountancy Magazine; Enron; Institute of Chartered Accountants; Wales; Management Solutions; Racal Electronics; US; Racal Telecom; UK; Vodafone;,Pensions Investment Research Consultants Accountancy Magazine Enron Institute of Chartered Accountants Wales Management Solutions Racal Electronics US Racal Telecom UK Vodafone,2023-04-06 12:35:10.208373,No
16077,844330,VOD.L,2002-07-31,2002-07-30, Vodafone;,Vodafone stands behind method of revenue calculation, BT Group; France Telecom; Deutsche Telekom; US; Global Crossing; JP Morgan Chase; Goldman Sachs;,BT Group France Telecom Deutsche Telekom US Global Crossing JP Morgan Chase Goldman Sachs,2023-04-06 12:35:18.258594,No
16078,846444,VOD.L,2002-08-13,2002-08-12, Vodafone;,Upgrades for Vodafone arms, Goldman Sachs; UK;,Goldman Sachs UK,2023-04-06 12:35:36.708919,Yes
16079,854374,VOD.L,2002-09-26,2002-09-25, Vodafone;,US investors file action of 'misrepresentation' against Vodafone, US; Vodafone;,US Vodafone,2023-04-06 12:35:50.214246,Yes
16080,858101,VOD.L,2002-10-15,2002-10-14, Vodafone;,Vodafone steps up efforts to control SFR, BT Group; UK; Progress; SBC Communications; US; SBC;,BT Group UK Progress SBC Communications US SBC,2023-04-06 12:35:58.207238,No
16081,858553,VOD.L,2002-10-17,2002-10-16, Vodafone;,"Vodafone piles on the pressure: Acquisitive mobile operator is intent on
plugging a gaping European hole, says Tim Burt, Rob Budden and Martin Arnold:", UK; SBC; Houghton Mifflin; US; Vivendi; BT; SFR; JP Morgan; Euros; Universal Publishing; Investec Securities;,UK SBC Houghton Mifflin US Vivendi BT SFR JP Morgan Euros Universal Publishing Investec Securities,2023-04-06 12:36:06.272000,No
16082,863952,VOD.L,2002-11-13,2002-11-12, Vodafone;,"Good reception for Vodafone but mixed signals for future: Interims bring sector
cheer but analysts are split on whether the performance is sustainable, writes
Robert Budden:", Goldman Sachs; Investec Securities;,Goldman Sachs Investec Securities,2023-04-06 12:36:19.493650,Yes
16083,863986,VOD.L,2002-11-13,2002-11-12, Vodafone;,"Vodafone helps Footsie consolidate above 4,000", Vodafone; US; FTSE SmallCap; Nasdaq Composite; UN; Capital Economics; Bank of England; MMO;,Vodafone US FTSE SmallCap Nasdaq Composite UN Capital Economics Bank of England MMO,2023-04-06 12:36:27.518725,No
16084,871553,VOD.L,2002-12-19,2002-12-18, Vodafone;,Gent's long goodbye signals Vodafone's switch to 3G focus STRATEGY:, AirTouch Communications; Accel-KKR Telecom; US;,AirTouch Communications Accel KKR Telecom US,2023-04-06 12:36:40.703546,Yes
16085,900639,VOD.L,2003-05-28,2003-05-27, Vodafone;,"UK: Vodafone bids farewell to its chief architect: Sir Christopher Gent's tenure
has seen the transformation of the mobile operator, writes Robert Budden", US; 120m;,US m,2023-04-06 12:36:56.336785,Yes
16086,905787,VOD.L,2003-06-24,2003-06-23, Vodafone;,Vodafone tunes in to mobile challenges TELECOMMUNICATIONS:, US; Salomon Smith Barney; BT Group; MMO; Deutsche Telekom;,US Salomon Smith Barney BT Group MMO Deutsche Telekom,2023-04-06 12:37:04.380249,No
16087,919635,VOD.L,2003-09-08,2003-09-07, Vodafone;,Vodafone to spearhead 3G launch with Asian handsets, Samsung; Vodafone; Nomura; Carphone Warehouse;,Samsung Vodafone Nomura Carphone Warehouse,2023-04-06 12:37:17.532749,Yes
16088,927963,VOD.L,2003-10-20,2003-10-19, Vodafone;,"Vodafone picks up calls on big issues: Alison Maitland talks to Charlotte Grezo,
one of the new guardians of responsible behaviour:", Democratic Republic; BP; FFI; Amnesty International; Motorola; Catholic Agency; Overseas Development; Supply; CSR;,Democratic Republic BP FFI Amnesty International Motorola Catholic Agency Overseas Development Supply CSR,2023-04-06 12:37:37.539455,Yes
16089,934531,VOD.L,2003-11-19,2003-11-18, Vodafone;,Vodafone provides sole spark in weak Footsie LONDON:, Lloyds; TSB; Deutsche Bank; Smith Barney; Deutsche.; Vodafone; Peer; Colt Telecom; Morgan Stanley; Credit Suisse First Boston; GUS; Evolution Beeson Gregory; Life; Dimension Data; GWR; British Airways; Arden Partners; Publisher Taylor; US; ABN Amro;,Lloyds TSB Deutsche Bank Smith Barney Deutsche Vodafone Peer Colt Telecom Morgan Stanley Credit Suisse First Boston GUS Evolution Beeson Gregory Life Dimension Data GWR British Airways Arden Partners Publisher Taylor US ABN Amro,2023-04-06 12:37:45.727261,No
16090,934617,VOD.L,2003-11-19,2003-11-18, Vodafone;,Vodafone provides Footsie's sole spark LONDON:, Lloyds; TSB; Deutsche Bank; Smith Barney; Deutsche.; Vodafone; Peer; Colt Telecom; Morgan Stanley; Credit Suisse First Boston; GUS; Life;,Lloyds TSB Deutsche Bank Smith Barney Deutsche Vodafone Peer Colt Telecom Morgan Stanley Credit Suisse First Boston GUS Life,2023-04-06 12:37:53.781284,No
16091,937658,VOD.L,2003-12-04,2003-12-03, Vodafone;,Vodafone chief refuses to rule out buying all of Vivendi, Foreign Press Association; BT Group; SBC Communications; BT; SFR; Canal Plus; US; NBC; General Electric; Vodafone; Publishing;,Foreign Press Association BT Group SBC Communications BT SFR Canal Plus US NBC General Electric Vodafone Publishing,2023-04-06 12:38:01.883455,No
16092,941135,VOD.L,2003-12-22,2003-12-21, Vodafone;,"'Brand is a big issue. When people think mobile products and services, we want
them to go to Vodafone' he prepares to launch 3G' As he prepares to launch 3G
services next autumn, Arun Sarin, the mobile operator's new chief executive,
tells Robert Budden and Tim Burt that premium content and better marketing - not
more acquisitions - are the priorities", Vodafone; AirTouch Communications; US; Goldman Sachs; Citigroup Smith Barney; Microsoft; British Sky Broadcasting; McDonald's.; Indian Institute of Technology; University of California at Berkeley; BT Group; Cable & Wireless; Baird; Bell and Edison;,Vodafone AirTouch Communications US Goldman Sachs Citigroup Smith Barney Microsoft British Sky Broadcasting McDonald s Indian Institute of Technology University of California at Berkeley BT Group Cable Wireless Baird Bell and Edison,2023-04-06 12:38:10.151504,No
16093,941379,VOD.L,2003-12-23,2003-12-22, Vodafone Group;,Verizon and Vodafone to get text messages flowing across the Atlantic, Vodafone Group; US; Verizon Communications; Deutsche Telekom; Great Britain; CDMA; Mobile Data Association;,Vodafone Group US Verizon Communications Deutsche Telekom Great Britain CDMA Mobile Data Association,2023-04-06 12:38:18.165252,No
16094,949657,VOD.L,2004-02-10,2004-02-09, Vodafone;,Vodafone might seek AT&T, US;,US,2023-04-06 12:38:39.615661,Yes
16095,951261,VOD.L,2004-02-18,2004-02-17, Vodafone;,Cingular grabs AT&TW from sleeping Vodafone, US; BellSouth; SBC; AT&T Wireless; Standard Life;,US BellSouth SBC AT T Wireless Standard Life,2023-04-06 12:38:56.444899,Yes
16096,973185,VOD.L,2004-06-11,2004-06-10, Vodafone;,Arun Sarin's Vodafone pay nears Pounds 3.2m TELECOMMUNICATIONS:, Vodafone; US; National Association of Pension Funds;,Vodafone US National Association of Pension Funds,2023-04-06 12:39:04.534059,No
16097,991920,VOD.L,2004-09-28,2004-09-27, Vodafone;,Vodafone signals higher pay-outs TELECOMMUNICATIONS:, US;,US,2023-04-06 12:39:22.813296,Yes
16098,998872,VOD.L,2004-11-10,2004-11-09, Vodafone;,Vodafone and 3G MARTIN DICKSON - LOMBARD, Vodafone;,Vodafone,2023-04-06 12:39:40.011543,Yes
16099,1035089,VOD.L,2005-07-07,2005-07-06, Vodafone Group;,Joussen rises at Vodafone Germany PEOPLE, Vodafone Group;,Vodafone Group,2023-04-06 12:39:53.625892,Yes
16100,1038088,VOD.L,2005-07-27,2005-07-26, Vodafone Group;,And finally . . . Vodafone Group, Vodafone Group;,Vodafone Group,2023-04-06 12:40:07.252225,Yes
16101,1038088,VOD.L,2005-07-27,2005-07-26, Vodafone Group;,And finally . . . Vodafone Group, Vodafone Group;,Vodafone Group,2023-04-06 12:40:20.797640,Yes
16102,1054677,VOD.L,2005-11-16,2005-11-15, Vodafone;,"Vodafone market value drops Pounds 9bn after warning over  top-line outlook
LONDON", Cable & Wireless; BT Group; Guinness; BAE Systems; Royal Navy; VT Group; Bank of America; Barclays; BOC; InterContinental Hotels; Hilton Group; Hilton Corporation; US; Smith & Nephew; Deutsche Bank; Southern Energy; Northern Foods; Kensington Group;,Cable Wireless BT Group Guinness BAE Systems Royal Navy VT Group Bank of America Barclays BOC InterContinental Hotels Hilton Group Hilton Corporation US Smith Nephew Deutsche Bank Southern Energy Northern Foods Kensington Group,2023-04-06 12:40:28.953567,No
16103,1059003,VOD.L,2005-12-14,2005-12-13, Vodafone;,"Vodafone in Dollars 4.6bn Telsim deal *UK telecommunications group outbids five
competitors *Deal 'will dilute earnings for five years' *Reserve price was
Dollars 2.8bn", UK; Motorola; US;,UK Motorola US,2023-04-06 12:40:36.937345,No
16104,1064444,VOD.L,2006-01-24,2006-01-23, Vodafone;,"Big investor hits at Vodafone *Standard Life Investments criticises group's
global strategy *Call to sell Verizon holding *Statement reflects growing
concern", Standard Life Investments; UK; US; F&C Asset Management;,Standard Life Investments UK US F C Asset Management,2023-04-06 12:40:45.034604,No
16105,1064491,VOD.L,2006-01-24,2006-01-23, Vodafone;,"Jittery Vodafone shareholders ask management to ring the  changes Investors in
the UK's biggest mobile operator are becoming increasingly nervous. Kate Burgess
and Mark Odell explain why they fear the management's 'wait and see' strategy is
unsustainable", Standard Life Investments; UK; Standard Life; US; Deutsche Telekom; France Telecom;,Standard Life Investments UK Standard Life US Deutsche Telekom France Telecom,2023-04-06 12:40:58.248262,Yes
16106,1064687,VOD.L,2006-01-25,2006-01-24, Vodafone;,Vodafone defends strategy but hints at US withdrawal, US; Verizon Communications; Standard Life Investments;,US Verizon Communications Standard Life Investments,2023-04-06 12:41:06.253753,No
16107,1065817,VOD.L,2006-02-01,2006-01-31, Vodafone;,Vodafone founder Horn-Smith retires, US; Lloyds TSB; Smiths Group; Hermes Pension Management;,US Lloyds TSB Smiths Group Hermes Pension Management,2023-04-06 12:41:19.394198,Yes
16108,1065848,VOD.L,2006-02-01,2006-01-31, Vodafone;,Vodafone board changes give time to Bond, Standard Life Investments; US;,Standard Life Investments US,2023-04-06 12:41:32.580806,Yes
16109,1070018,VOD.L,2006-02-28,2006-02-27, Vodafone;,"Vodafone reaches turning point, but unsure of direction The global mobile
operator has lost its way since its hubristic takeover of German rival
Mannesmann six years ago, and shareholders are increasingly restless, write
Andrew Edgecliffe-Johnson and Kate Burgess", Standard Life; Investec Securities; Vodafone;,Standard Life Investec Securities Vodafone,2023-04-06 12:41:40.574527,No
16110,1070937,VOD.L,2006-03-06,2006-03-05, Vodafone;,Vodafone shareholders set for bonus MOBILE TELECOMMUNICATIONS, 97.7;,,2023-04-06 12:41:48.543737,No
16111,1083406,VOD.L,2006-05-24,2006-05-23, Vodafone Group;,Vodafone misses the rally because of trepidation about its  results LONDON, Vodafone Group; Merrill Lynch; Verizon Communications; Morgan Stanley; BP Group; Royal Dutch Shell; BG Group; Liberty International; Land Securities; UK; Associated British; London Stock Exchange; New York Stock Exchange; Nasdaq;,Vodafone Group Merrill Lynch Verizon Communications Morgan Stanley BP Group Royal Dutch Shell BG Group Liberty International Land Securities UK Associated British London Stock Exchange New York Stock Exchange Nasdaq,2023-04-06 12:41:56.666897,No
